ID,談話関係,Arg1（1つ目の文）,Arg2（2つ目の文）
w201106-0000440319,原因・理由(順方向),情報技術学院で開催中の『パソコンセミナー』は、カリキュラム変更のため一時中止させていただく事になりました。,参加希望の生徒様には、大変ご迷惑をおかけしますが、
w201106-0000440319,原因・理由(順方向)  談話関係なし:少数意見,情報技術学院で開催中の『パソコンセミナー』は、カリキュラム変更のため一時中止させていただく事になりました。,ご了承ください。
w201106-0002900317,目的(順方向),戦闘後、拿捕を防ぐため,港内でコレーエツは爆破され、
w201106-0002900317,目的(順方向),戦闘後、拿捕を防ぐため,ヴァリャーグも自沈した。
w201106-0002900317,目的(順方向),戦闘後、拿捕を防ぐため,また、スリンガーも自沈している。
w201106-0000155609,原因・理由(順方向),いべさんがご紹介するその他のイベントの一覧です。,何か面白いイベントを探されている方も、週末の予定を決めあぐねている方も是非ご覧になって下さい。
w201106-0000155609,条件(順方向),各タイトルをクリックすると,各イベントの詳細情報がご覧頂けます。
w201106-0000155609,談話関係なし  原因・理由(順方向):少数意見,各イベントの詳細情報がご覧頂けます。,何か面白いイベントを探されている方も、週末の予定を決めあぐねている方も是非ご覧になって下さい。
w201106-0001360068,原因・理由(順方向),パソコン整備士検定試験の練習問題を提供しております。,各設問に対して正しいと思われる選択肢にチェックを入れて下さい。
w201106-0001360068,条件(順方向),画面下にある『練習問題に挑戦する』ボタンをクリックすると、,練習問題が開始されます。
w201106-0001360068,原因・理由(順方向),練習問題が開始されます。,各設問に対して正しいと思われる選択肢にチェックを入れて下さい。
w201106-0002600085,対比(方向なし),かつては大型コンピューター開発生産事業を行っていた。,現在はテレコム・イタリアに買収され、
w201106-0002600085,対比(方向なし),かつては大型コンピューター開発生産事業を行っていた。,主にシステムソリューション事業を運営している。
w201106-0000336294,原因・理由(順方向),この記事の内容に関する文献や情報源が必要です。,ご存じの方はご提示ください。
w201106-0000336294,目的(逆方向)  談話関係なし:少数意見,この記事の内容に関する文献や情報源が必要です。,出典を明記するために
w201106-0000336294,原因・理由(順方向),この記事の内容に関する文献や情報源が必要です。,ご協力をお願いします。
w201106-0000336294,目的(逆方向),ご存じの方はご提示ください。,出典を明記するために
w201106-0000336294,目的(順方向),出典を明記するために,ご協力をお願いします。
w201106-0001837876,原因・理由(逆方向)  談話関係なし:少数意見,私たちは、常にプロフェッショナルとして、顧客のために行動いたします。,当事務所の弁護士は、「丁寧なサービス」と「社会への貢献」をその使命としております。
w201106-0001837876,原因・理由(順方向),当事務所の弁護士は、「丁寧なサービス」と「社会への貢献」をその使命としております。,常に、良質で丁寧なサービスを提供することを目指します。
w201106-0001628055,原因・理由(順方向),少しずつ増えていきますので,ご確認下さい。
w201106-0001859317,原因・理由(順方向)  談話関係なし:少数意見,三井海上と住友海上が合併しました。,１０／１より三井住友海上火災保険株式会社となります。
w201106-0001145637,逆接・譲歩(順方向),結婚を切望する相談者がたくさんいます。,そういう人は総じて、大切な縁を持つ人を見逃している場合が多いのです。
w201106-0001145637,条件(順方向),綿密な特徴、そして入籍日まで知っておけば、,宿命の伴侶は確実に浮かび上がってきますよ。
w201106-0002300234,条件(順方向),連休があって,旅をしない俺ではない。
w201106-0002300234,原因・理由(順方向),旅をしない俺ではない。,したがって旅をしているのだ。
w201106-0002300234,逆接・譲歩(順方向),今回は全然失恋の類はしていないのだが、,「ある種の傷心旅行」と位置づけている。
w201106-0001623041,逆接・譲歩(順方向),男女とも姓のみを彫刻しますが、,女性の場合は名前のみでも構いません。
w201106-0001596360,目的(逆方向),大手の日本調剤は漢方薬局と組み,健康食品を取り扱い始めた。
w201106-0001666510,逆接・譲歩(順方向)  談話関係なし:少数意見,前回のコラムでは「管理職は人を管理するな。,仕事を管理せよ」と書きました。
w201106-0001666510,原因・理由(逆方向),前回のコラムでは「管理職は人を管理するな。,どうしても個人的な好き嫌いの管理になる。
w201106-0001666510,原因・理由(逆方向),前回のコラムでは「管理職は人を管理するな。,それでは組織はよどんでしまう。
w201106-0001666510,談話関係なし  原因・理由(逆方向):少数意見,仕事を管理せよ」と書きました。,それでは組織はよどんでしまう。
w201106-0001666510,条件(順方向),人を管理すると、,どうしても個人的な好き嫌いの管理になる。
w201106-0001666510,条件(順方向),人を管理すると、,それでは組織はよどんでしまう。
w201106-0001666510,原因・理由(順方向),どうしても個人的な好き嫌いの管理になる。,それでは組織はよどんでしまう。
w201106-0001018949,逆接・譲歩(順方向),おいしいごはんのメニューがたっぷりあるバーってなかなかないですよね。,でもここは本格的な料理が揃っているのがうれしい。
w201106-0001018949,逆接・譲歩(順方向)  談話関係なし:少数意見,おいしいごはんのメニューがたっぷりあるバーってなかなかないですよね。,香ばしいパンに、ジューシーなフォアグラがガツンと挟まった”フォアグラサンドウィッチ”なんてメニューもあるんです。
w201106-0002900121,原因・理由(逆方向)  談話関係なし:少数意見,害をもたらすものは排除しなければならない。,それが大人の道理であることは間違いないのだけれど。
w201106-0002900121,原因・理由(逆方向)  談話関係なし:少数意見,巨大な力を持つものは責任を負わなければならない。,それが大人の道理であることは間違いないのだけれど。
w201106-0001150386,逆接・譲歩(順方向),今、円高で日本の製造業が悲鳴を上げている。,しかし、私は打開策はいくらでもあると思う。
w201106-0000347315,目的(順方向),本市では各学校園教員の指導力向上を図るために、,「アシスタントティーチャー」派遣事業を実施しております。
w201106-0000347315,談話関係なし  目的(順方向):少数意見,本市では各学校園教員の指導力向上を図るために、,第一線から退かれている皆様のお力を是非お貸し下さい。
w201106-0000347315,原因・理由(順方向),「アシスタントティーチャー」派遣事業を実施しております。,第一線から退かれている皆様のお力を是非お貸し下さい。
w201106-0001186263,談話関係なし  目的(逆方向):少数意見,平成１８年の一冊目から遡って,登録していきたいと思っております。
w201106-0002200135,原因・理由(順方向),皆さまに支えられ,４０周年！
w201106-0002200135,原因・理由(順方向)  談話関係なし:少数意見,４０周年！,日頃のご愛顧にお応えして
w201106-0002200135,原因・理由(順方向),４０周年！,謝恩価格プランにて皆さまのお越しを心からお待ちしております。
w201106-0002200135,目的(順方向)  原因・理由(順方向):少数意見,日頃のご愛顧にお応えして,謝恩価格プランにて皆さまのお越しを心からお待ちしております。
w201106-0002200135,原因・理由(順方向)  談話関係なし:少数意見,日頃のご愛顧にお応えして,お得な学割プラン２，７００円〜もあります。
w201106-0000672177,目的(順方向),社内勉強会を適切に運営し続けるためには,どのような工夫が必要なのか。
w201106-0001617740,原因・理由(順方向),多くの女性の心には、いつも水子のことがあります。,自分でご供養されたい方の、お手伝いをします。
w201106-0001617740,原因・理由(順方向),多くの女性の心には、いつも水子のことがあります。,電話、または面談で、方法などをお伝えします。
w201106-0001617740,目的(順方向),自分でご供養されたい方の、お手伝いをします。,電話、または面談で、方法などをお伝えします。
w201106-0001456910,逆接・譲歩(順方向),一口に経営コンサルタントといっても,いくつかに分類できます。
w201106-0001456910,逆接・譲歩(順方向),いくつかに分類できます。,しかし、特に決まった分類方法があるわけではありません。
w201106-0002000098,逆接・譲歩(順方向),やさしい色合いですが、,色々な願いを込めた欲張りな組み合わせです。
w201106-0001563550,原因・理由(順方向),オメガスピードマスターウオッチ、オメガシーマスターなどを通販でお安く購入出来る通販サイトの、御案内をしています。,掲載されたネットショップで必ずあなたのお好み時計がお安くみつかることを期待します。
w201106-0002500026,談話関係なし  その他根拠(順方向):少数意見,ピットから漏れた水が海に流れ出しているのがはっきりと分かる。,その量が相当なものになっていることは間違いない。
w201106-0002500026,談話関係なし  その他根拠(順方向):少数意見,ピットから漏れた水が海に流れ出しているのがはっきりと分かる。,１時間当たりトン単位になっていることは間違ない。
w201106-0002500026,その他根拠(順方向),水の流れの高さ方向の幅が２０センチというから,その量が相当なものになっていることは間違いない。
w201106-0002500026,その他根拠(順方向),水の流れの高さ方向の幅が２０センチというから,１時間当たりトン単位になっていることは間違ない。
w201106-0002600329,原因・理由(順方向),ほかに側線もあり、,電車が留置されていることがある。
w201106-0002900130,逆接・譲歩(順方向),残念なことに、私がこの場所に入れたのは、たった１０日の旅行の間だけでした。,しかしその旅行の思い出は、私の故郷を歩き回る時でさえ、決して興奮が覚めることはありませんでした。
w201106-0002700073,原因・理由(順方向),プッシュするのも安定感あって,ぐらぐらしないから
w201106-0002700073,原因・理由(順方向),プッシュするのも安定感あって,片手で十分ＯＫ！
w201106-0002700073,原因・理由(順方向),ぐらぐらしないから,片手で十分ＯＫ！
w201106-0002700073,原因・理由(逆方向)  その他根拠(順方向):少数意見,液だれに関しては今のことろ見られませんよ！,液自体をたっぷり入れすぎてないからかもね！
w201106-0001994353,原因・理由(順方向),６２期生２年生が６／２４〜６／２７の予定で北海道へ修学旅行に行っています。,その様子をお伝えします。
w201106-0002900003,条件(順方向),あんな技が出来たら,楽しいだろうな。
w201106-0002400305,談話関係なし  原因・理由(逆方向):少数意見,ボリス・イオファンらロシア人２人とアメリカ人１人による計３案が同時に勝者に選ばれた。,新古典主義に基盤を置いた案だった。
w201106-0002400305,原因・理由(逆方向),ボリス・イオファンらロシア人２人とアメリカ人１人による計３案が同時に勝者に選ばれた。,これにはレーニンと嗜好が違ったヨシフ・スターリンらの意向があった。
w201106-0002400305,談話関係なし  原因・理由(逆方向):少数意見,新古典主義に基盤を置いた案だった。,これにはレーニンと嗜好が違ったヨシフ・スターリンらの意向があった。
w201106-0001056314,原因・理由(順方向),上記にて使用されている製品は全て研究用です。,研究用以外の目的には使用しないでください。
w201106-0001056314,原因・理由(順方向),ヒト、動物の診断あるいは治療用としては承認されておりません。,研究用以外の目的には使用しないでください。
w201106-0002500291,原因・理由(順方向),そのソウルフルかつ圧倒的な歌唱力で多くの人を魅了し、,幅広い層からの支持を得ている。
w201106-0002500217,原因・理由(順方向),うん、やっぱり橋下さん好きです。,がんばってほしいな。
w201106-0002900223,条件(順方向),アルミワイヤーや銅線、真鍮線等の細い物を切る際、,切断面の切り口が尖がってしまう従来のニッパー。
w201106-0002900223,逆接・譲歩(順方向),切断面の切り口が尖がってしまう従来のニッパー。,本ワイヤーアートニッパーは切断面を平らに切断する事が可能です！
w201106-0001750121,談話関係なし  目的(逆方向):少数意見,自宅サロンを拠点に、契約挙式ホテル、イベント、出張ネイルをしています。,生活と心に彩るネイルを目指します。
w201106-0001750121,原因・理由(順方向),自宅サロンを拠点に、契約挙式ホテル、イベント、出張ネイルをしています。,お気軽にお問い合わせ下さい。
w201106-0001750121,談話関係なし  原因・理由(順方向):少数意見,生活と心に彩るネイルを目指します。,お気軽にお問い合わせ下さい。
w201106-0001750121,談話関係なし  原因・理由(順方向):少数意見,カルジェル、バイオ、アクセンツなど取り扱い、,お気軽にお問い合わせ下さい。
w201106-0001453523,原因・理由(逆方向),やっぱり、秋に緑色は似合わない。,わたしの着ている緑色のカーディガンの袖が視界の中央、居心地悪そうに浮かび上がる。
w201106-0001453523,原因・理由(逆方向),そう思わずにいられない。,わたしの着ている緑色のカーディガンの袖が視界の中央、居心地悪そうに浮かび上がる。
w201106-0001111466,逆接・譲歩(順方向),ミネラルウォーターやビール、ジュースはまとめ買いをしておくのが便利ですが、,かさばるので
w201106-0001111466,逆接・譲歩(順方向),ミネラルウォーターやビール、ジュースはまとめ買いをしておくのが便利ですが、,置き場所に困ってしまいます。
w201106-0001111466,原因・理由(順方向),かさばるので,置き場所に困ってしまいます。
w201106-0001111466,原因・理由(順方向),かさばるので,基本的には、これらのストックは納戸にしまっておくのがよいでしょう。
w201106-0001111466,逆接・譲歩(順方向),置き場所に困ってしまいます。,ただ、何本かはキッチンまわりの引出しや収納棚に入れておいてもよいですね。
w201106-0001111466,逆接・譲歩(順方向),基本的には、これらのストックは納戸にしまっておくのがよいでしょう。,ただ、何本かはキッチンまわりの引出しや収納棚に入れておいてもよいですね。
w201106-0002100384,条件(順方向),ボールについたロープを使えば、,簡単に遠くに投げることができます。
w201106-0002100389,目的(順方向),２０１０年夏に、ＪＲ東海が飯田線に観光列車「そよ風トレイン１１７」を走らせるために、,Ｓ９編成を改造したものである。
w201106-0002100389,談話関係なし  原因・理由(順方向):少数意見,Ｓ９編成を改造したものである。,車内から沿線の風景や風を楽しめるようになっている。
w201106-0001936431,条件(順方向),このシーズンになると、,いつもは閑静な住宅街も、イルミネーションで華やかに飾られます。
w201106-0001936431,談話関係なし  原因・理由(順方向):少数意見,いつもは閑静な住宅街も、イルミネーションで華やかに飾られます。,写真におさめる家庭もあるとか。
w201106-0001936431,目的(逆方向)  談話関係なし:少数意見,このイルミネーションをプロのカメラマンに頼んで,写真におさめる家庭もあるとか。
w201106-0002100069,原因・理由(順方向),久しぶりに夫の親友から電話があった。,長々と話していて
w201106-0002100069,原因・理由(順方向),久しぶりに夫の親友から電話があった。,夫の足は浮足立っていた。
w201106-0002100069,原因・理由(順方向),長々と話していて,でもそのあと夫は深夜遅くまで勉強していた。
w201106-0000119495,目的(順方向),生乳本来の風味と栄養を大切にするため、,低温殺菌を行っているおいしい牛乳です。
w201106-0001752087,逆接・譲歩(順方向)  逆接・譲歩(逆方向):少数意見,保育園では障害のある子供もない子供も一緒に元気に育ちます。,障害児の受け入れには自治体によって制限を設けている所もあります。
w201106-0001752087,原因・理由(順方向),入園には一定の条件があるので,事前に確認が必要です。
w201106-0001752087,原因・理由(逆方向)  談話関係なし:少数意見,事前に確認が必要です。,障害児の受け入れには自治体によって制限を設けている所もあります。
w201106-0002300293,逆接・譲歩(順方向),つまりホーム別１・２番線、３・４番線はそれぞれ同じであるが、,下段の案内が流れるタイミングは異なる。
w201106-0002300293,逆接・譲歩(順方向),列車入線前には下段に「電車がまいります」との表示が出るが、,それが上段に表示されている列車であるとは限らない。
w201106-0001074437,原因・理由(逆方向)  談話関係なし:少数意見,独特な食文化をもつ。,日本と沖縄の両方から影響を受け、
w201106-0001074437,原因・理由(順方向)  談話関係なし:少数意見,日本と沖縄の両方から影響を受け、,黒砂糖、豚肉を使った料理が多い。
w201106-0002300296,逆接・譲歩(順方向),確実に街並みは変貌しているが、,残して欲しいモノは残ってたりして。
w201106-0002300352,原因・理由(順方向),ひじきたっぷりで、,おいしい〜！
w201106-0002300352,原因・理由(順方向),ひじきたっぷりで、,体にもうれしい掻き揚げです。
w201106-0002400280,談話関係なし  原因・理由(順方向):少数意見,もう１０月です。,そしてここタイの雨季もあと１ヶ月の我慢です。
w201106-0000687023,原因・理由(順方向),又、当店は、オフィス街に位置しているという事もあり,法人様を多数担当させていただいております。
w201106-0000312992,原因・理由(逆方向),１２月の作成分をもう始めています。,バタバタするのがイヤなので・・・。
w201106-0000406275,原因・理由(順方向),フリーキャッシュフローは企業が提出する決算書には出てきませんので、,自分たちで算出する必要があります。
w201106-0001522322,条件(順方向),ずっとこのままでいられたら,幸せだ。
w201106-0001522322,原因・理由(順方向),幸せだ。,その後もパパとの関係を崩さないように努力した。
w201106-0001522322,原因・理由(順方向),幸せだ。,もちろん彼には写真を見てしまった事なんか絶対に打ち明けられないと思った。
w201106-0001522322,原因・理由(順方向),僕にはそれが分かっていたから、,その後もパパとの関係を崩さないように努力した。
w201106-0001522322,談話関係なし  原因・理由(順方向):少数意見,僕にはそれが分かっていたから、,もちろん彼には写真を見てしまった事なんか絶対に打ち明けられないと思った。
w201106-0001522322,談話関係なし  原因・理由(順方向):少数意見,その後もパパとの関係を崩さないように努力した。,もちろん彼には写真を見てしまった事なんか絶対に打ち明けられないと思った。
w201106-0001546150,談話関係なし  逆接・譲歩(順方向):少数意見,常陸の国の出身ですが、,鎌倉で万葉集の研究をし、
w201106-0000158200,談話関係なし  逆接・譲歩(逆方向):少数意見,不正利用される場合があります。,実際にクレジットカードがなくても、
w201106-0000158200,原因・理由(順方向),不正利用される場合があります。,他人に不正使用されないように、きちんと自分で処分しましょう。
w201106-0000158200,逆接・譲歩(順方向),実際にクレジットカードがなくても、,ご利用控えに載っている情報から通信販売などで悪用される事件が多発しています。
w201106-0000158200,原因・理由(順方向),ご利用控えに載っている情報から通信販売などで悪用される事件が多発しています。,他人に不正使用されないように、きちんと自分で処分しましょう。
w201106-0001763494,原因・理由(順方向),メールアドレスが不備で,メールをお送りできませんでした。
w201106-0001629631,原因・理由(順方向)  逆接・譲歩(順方向):少数意見,北海道ではまだ馴染みの薄いレストラン・ウェディングだ。,可能性は無限に広がる。
w201106-0000067136,条件(順方向)  談話関係なし:少数意見,名入れタオルをご注文頂いてから、,最短４日後にお手元にお届け致します。
w201106-0002400057,談話関係なし  原因・理由(順方向):少数意見,夏休み、,ハリー・ポッターは唯一の身寄りであるダーズリー家へ帰省していた。
w201106-0002300059,原因・理由(逆方向),今のところラッピングサービスはしておりません。,当店は零細ショップですので、
w201106-0002300059,原因・理由(順方向),当店は零細ショップですので、,簡易梱包にて出荷させていただいております。
w201106-0001118658,談話関係なし  対比(方向なし):少数意見,小学生では１０万人当たり６人ですが、,中学生になると約１９人、症例の９割には肥満ありとの報告でした。
w201106-0001413580,条件(順方向),よって申請時に一定の要件を満たせば,ほぼ１００％受給できます。
w201106-0001696274,逆接・譲歩(順方向),円形脱毛症とは、どの年齢でも起こりうる病気です。,しかし、原因がはっきりとはわかってはいません。
w201106-0001696274,逆接・譲歩(順方向)  逆接・譲歩(逆方向):少数意見,ストレスが誘引ではないかと考えられています。,しかし、原因がはっきりとはわかってはいません。
w201106-0000616585,談話関係なし  対比(方向なし):少数意見,日本一、湧出量の多い温泉地は大分県の別府だ。,２位も大分県の湯布院で、
w201106-0001582590,原因・理由(順方向)  談話関係なし:少数意見,お祝いに「羽衣」の天人の人形を頂いた。,新居の玄関に飾り、
w201106-0001582590,原因・理由(順方向),新居の玄関に飾り、,朝夕、目にした。
w201106-0000806979,原因・理由(順方向)  談話関係なし:少数意見,作図問題やユニークな論証など、良問で有名です。,通常の塾のテキストに加えて、思考力を身につけることが必要です。
w201106-0000173328,原因・理由(順方向)  談話関係なし:少数意見,山形新聞社では掲載記事を１９９９年１２月２０日付からデータベースとして蓄積しています。,目的の記事を簡単に見つけられます。
w201106-0000173328,原因・理由(順方向),検索は、入力された言葉が記事中で使われているかどうかで探しますので、,目的の記事を簡単に見つけられます。
w201106-0001404718,逆接・譲歩(順方向),カリキュラムはありますが、,ご自分のペースでじっくりと取り込むことができます。
