ID,談話関係,Arg1（1つ目の文）,Arg2（2つ目の文）
w201106-0000070695,原因・理由(順方向),ちょっとした手間で本格的な物になりますよ。,材料は、冷蔵庫の残り物で十分。
w201106-0000070695,原因・理由(順方向),ちょっとした手間で本格的な物になりますよ。,あるものを使っちゃいましょう。
w201106-0000467346,原因・理由(順方向),こちらのお店は豆腐かつ煮が名物で、,お昼時には大変な行列ができるのだとか。
w201106-0001202383,原因・理由(逆方向)  その他根拠(順方向):少数意見,米大統領選の民主党候補指名を争うクリントン上院議員に対してオバマ上院議員が怒った。,オバマ氏の失言を執拗に追及するクリントン氏の戦術が腹に据えかねたよう。
w201106-0002800098,原因・理由(順方向),なかなか傑作ポチ写真が出ない当ブログですので,今後も頑張っていきたいと思います！
w201106-0001620886,逆接・譲歩(順方向),七尾線の徳田駅はごく普通のローカル駅ではあるものの、,駅の一角がギャラリーになっています。
w201106-0001620886,逆接・譲歩(順方向),七尾線の徳田駅はごく普通のローカル駅ではあるものの、,駅の外観自体もかなり特徴的なものになっています。
w201106-0001620886,談話関係なし  逆接・譲歩(逆方向):少数意見,駅の一角がギャラリーになっています。,特別なものではないですが、
w201106-0001620886,逆接・譲歩(順方向),特別なものではないですが、,落ち着いた雰囲気になっています。
w201106-0001781836,談話関係なし  対比(方向なし):少数意見,クラス・サークル・ゼミ・職場・バイト先など、出会いの場は組織内であることって多いですよね。,個人と個人が出会う運命的な状況ってなかなかありません。
w201106-0001781836,原因・理由(順方向),クラス・サークル・ゼミ・職場・バイト先など、出会いの場は組織内であることって多いですよね。,そんな訳で今回は、組織内での恋愛を成功させる方法です。
w201106-0001781836,原因・理由(順方向),個人と個人が出会う運命的な状況ってなかなかありません。,そんな訳で今回は、組織内での恋愛を成功させる方法です。
w201106-0001002865,条件(順方向),当社と新たにお取引を始めてみませんか。,ご希望の方は下記メールアドレスからご連絡をお願い致します。
w201106-0001002865,原因・理由(順方向)  原因・理由(逆方向):少数意見,当社では、新たな発想で商品提案をして頂けるお取引先様を募集しています。,ご希望の方は下記メールアドレスからご連絡をお願い致します。
w201106-0002900063,原因・理由(順方向),カジュアルながら上品なトップスに、ボトムスはやはりラルフローレンのラインだけあって,タイトに着こなすのがお洒落です。
w201106-0000092302,逆接・譲歩(順方向),紹介予定派遣に限り派遣先との事前面接や履歴書の送付が認められている。,一般労働者派遣では、派遣先が派遣スタッフ個人を特定することは法律で禁じられている。
w201106-0000092302,原因・理由(順方向),紹介予定派遣に限り派遣先との事前面接や履歴書の送付が認められている。,そのため派遣スタッフに面接や履歴書の提出を求めることはできない。
w201106-0000092302,原因・理由(順方向),一般労働者派遣では、派遣先が派遣スタッフ個人を特定することは法律で禁じられている。,そのため派遣スタッフに面接や履歴書の提出を求めることはできない。
w201106-0001102679,原因・理由(順方向),平日は、夜８時まで営業してますので、,会社帰りにお寄りいただけます。
w201106-0002700274,原因・理由(順方向),アルファベットの元になったフェニキア文字もこの地で生まれた。,このことからアルファベット発祥の地と言われることもある。
w201106-0001368236,原因・理由(順方向),人は表現する方法をいろいろ持っている。,自分が表現しやすい方法で伝えたいことを表現すればいい。
w201106-0001153200,談話関係なし  原因・理由(順方向):少数意見,平成２２年４月１日より新会社として、営業を開始いたします。,これまで以上に地域に根ざした営業活動の徹底とサービスの提供を図ってまいります。
w201106-0001153200,談話関係なし  原因・理由(順方向):少数意見,平成２２年４月１日より新会社として、営業を開始いたします。,その業務を通して、お客様の暮らしかえの夢を実現するお手伝いができればと思っております。
w201106-0001153200,談話関係なし  原因・理由(順方向):少数意見,これまで以上に地域に根ざした営業活動の徹底とサービスの提供を図ってまいります。,その業務を通して、お客様の暮らしかえの夢を実現するお手伝いができればと思っております。
w201106-0000607737,談話関係なし  原因・理由(順方向):少数意見,たくさんの「むすび」を大切に、百姓暮らしをしています。,みなさまにお会いできるのを楽しみにしています。
w201106-0000478633,原因・理由(順方向),本日、自由奔放な我ら夫婦の生活は５年目の節目を迎えました。,妻には薔薇を贈ります。
w201106-0000947182,その他根拠(順方向),朝と夕方、イワツバメが上空を賑やかに飛び回っています。,現在、巣材集めの真っ最中のようです。
w201106-0000947182,その他根拠(順方向)  条件(順方向):少数意見,センター近くにある玄倉大橋に、ずら〜っと巣を作るのですが、,現在、巣材集めの真っ最中のようです。
w201106-0000947182,目的(順方向),センター近くにある玄倉大橋に、ずら〜っと巣を作るのですが、,泥や枯れ草をくちばしにくわえて飛び立っていきます。
w201106-0000947182,その他根拠(逆方向),現在、巣材集めの真っ最中のようです。,泥や枯れ草をくちばしにくわえて飛び立っていきます。
w201106-0000947182,目的(逆方向),湿った地面に降り立っては、,泥や枯れ草をくちばしにくわえて飛び立っていきます。
w201106-0000184070,条件(順方向),妊娠の診断を受けたら、,子ども育成課に届け出てください。
w201106-0000184070,条件(順方向),子ども育成課に届け出てください。,出生届や健診などで今後の母子の健康管理で必要な「母子健康手帳」などをお渡しします。
w201106-0002100283,原因・理由(順方向),高温の油で揚げるオイルローストに比べ、ドライロースト法は時間も掛かり、,生産性も劣ってしまいます。
w201106-0002100283,原因・理由(順方向),温度によりロースト時間も左右されます。,よって熟練の職人技が要求されるうえ、
w201106-0002100283,原因・理由(順方向),温度によりロースト時間も左右されます。,生産性も劣ってしまいます。
w201106-0002100283,談話関係なし  原因・理由(順方向):少数意見,よって熟練の職人技が要求されるうえ、,生産性も劣ってしまいます。
w201106-0000518081,その他根拠(順方向),兵庫県内のいろいろな所に行くので、,あなたともきっと会えますよね。
w201106-0000518081,条件(順方向),兵庫県内のいろいろな所に行くので、,その時は、応援してね。
w201106-0000518081,条件(順方向),あなたともきっと会えますよね。,その時は、応援してね。
w201106-0001352284,条件(順方向),乗車する日時・区間を指定して、,市電を借り切ることができます。
w201106-0001930919,原因・理由(順方向),古くからの温泉なので、,随所に歴史の面影があります。
w201106-0002100358,逆接・譲歩(順方向),あまりつぶやきません。,たまにつぶやきます。
w201106-0001894130,原因・理由(逆方向)  談話関係なし:少数意見,上半期を振り返りつつ,２０１０年の上半期の映画興行成績がまとまった。
w201106-0001593020,原因・理由(順方向),以下の公益信託の奨学金・研究助成金等の募集要項および申請書をダウンロードしていただくことができます。,募集期間については、各募集要項にてご確認ください。
w201106-0001593020,原因・理由(順方向),募集期間を終了している基金についても次年度応募のご参考に掲載していますので、,ご覧ください。
w201106-0001854108,逆接・譲歩(順方向),出雲湯村温泉は「出雲風土記」にも登場するという歴史のある温泉です。,とはいえ、歓楽的な要素はなくひっそりとした温泉地です。
w201106-0001854108,逆接・譲歩(順方向),出雲湯村温泉は「出雲風土記」にも登場するという歴史のある温泉です。,温泉街自体もそれほど大きな物ではなく、
w201106-0001854108,逆接・譲歩(順方向),出雲湯村温泉は「出雲風土記」にも登場するという歴史のある温泉です。,川沿いに集落があるだけという雰囲気です。
w201106-0001854108,条件(順方向),知らなければ,川沿いに集落があるだけという雰囲気です。
w201106-0002200323,逆接・譲歩(順方向),いま福岡で台湾シネマコレクションやってるんですが、,日程的に『シルク』くらいしか観られそうにないです。
w201106-0002200323,談話関係なし  逆接・譲歩(逆方向):少数意見,日程的に『シルク』くらいしか観られそうにないです。,観ないかもしれませんが。
w201106-0002200323,原因・理由(順方向),平日レイトなので,観ないかもしれませんが。
w201106-0000548462,逆接・譲歩(順方向),しかし、当然それを快く思わない人がいても,不思議ではありません。
w201106-0001729651,逆接・譲歩(順方向),１４６８年にはヨーク派に捕らえられるが、,ヘンリー６世復位の１４７０年に釈放された。
w201106-0000112018,原因・理由(順方向),昼くらいに大阪に着くので,夕方まで時間をつぶす予定です。
w201106-0000112018,原因・理由(順方向),昼くらいに大阪に着くので,難波パークスに行こうと思っています。
w201106-0000112018,談話関係なし  目的(順方向):少数意見,夕方まで時間をつぶす予定です。,難波パークスに行こうと思っています。
w201106-0000596408,原因・理由(順方向),医療脱脂綿に精製水と殺菌成分を含ませた清浄綿です。,皮膚の清浄、素肌の清潔に。
w201106-0000596408,原因・理由(順方向),蒸気滅菌された完全密閉の小包装なので、,いつでも衛生的に使えます。
w201106-0002200256,逆接・譲歩(順方向),不良がいないという高校に入学したアイコとミホ。,だが、その学校では郡司という教師による厳しい身体検査と体罰が行われていた。
w201106-0002200256,原因・理由(順方向),ある日、ミホは郡司から体罰を受けたのを苦にして,アイコの目の前で自殺してしまう。
w201106-0002500094,逆接・譲歩(順方向),チーズはおおよそは好き。,ただ、匂いのきついのがちょっとって感じですね。
w201106-0001091054,談話関係なし  原因・理由(順方向):少数意見,首都圏から３時間、豊かな自然に囲まれた箱庭には数多くの本物が隠れています。,ゆったりとした時間と空間の中でじっくりと自分回帰しましょう。
w201106-0001091054,目的(逆方向)  談話関係なし:少数意見,日頃の喧騒を離れ、,ゆったりとした時間と空間の中でじっくりと自分回帰しましょう。
w201106-0001091054,原因・理由(逆方向),ゆったりとした時間と空間の中でじっくりと自分回帰しましょう。,下田は、あなたの元気や健康の回復を目指す「タウン・セラピー」を提供します。
w201106-0001799726,原因・理由(順方向),ラッパーにのみ穴が開けば良いので、,あまり深く押し込む必要はありません。
w201106-0001811123,原因・理由(順方向),絵を描くのは苦手なので,またしても古いカラオケ仕様です。
w201106-0001811123,原因・理由(順方向),この曲は音域が非常に広いため、,難易度が高い曲です。
w201106-0002600095,原因・理由(順方向)  談話関係なし:少数意見,厚労省によると、日本では患者数６人と公表している（２００８年）。,販売によって利益水準に達することはない。
w201106-0002600095,逆接・譲歩(順方向),患者を多く見積もっても,販売によって利益水準に達することはない。
w201106-0002600095,談話関係なし  原因・理由(逆方向):少数意見,販売によって利益水準に達することはない。,慈善事業、宣伝広告を狙ったもの。
w201106-0001634602,条件(順方向),下のリストから、ご希望のミニマル種をクリックして,登録ができます。
w201106-0001634602,原因・理由(順方向)  談話関係なし:少数意見,登録ができます。,あなたのメモリアルデーを可愛いミニマルちゃんで飾ってください。
w201106-0002400037,逆接・譲歩(順方向),小沢氏はたぶん、そうした資金を受領していたのでしょう。,私がここで指摘したいのは「それがどうしました？」ということです。
w201106-0002400037,逆接・譲歩(順方向),小沢氏はたぶん、そうした資金を受領していたのでしょう。,真の問題点は小沢氏や秘書が金を受領していたかどうかではないのです。
w201106-0001041664,談話関係なし  逆接・譲歩(順方向):少数意見,園児計３２人、職員計３人が下痢や嘔吐などの症状を訴えた。,両施設の発症者はいずれも軽症で、
w201106-0001041664,逆接・譲歩(順方向),園児計３２人、職員計３人が下痢や嘔吐などの症状を訴えた。,快方に向かっているという。
w201106-0001041664,談話関係なし  原因・理由(順方向):少数意見,両施設の発症者はいずれも軽症で、,快方に向かっているという。
w201106-0000062632,目的(順方向)  条件(順方向):少数意見,お気に入り機能をご利用頂くためには、,ブラウザのクッキー機能を有効にする必要があります。
w201106-0002200175,原因・理由(順方向)  条件(順方向):少数意見,ネットを使える人は、オンラインでも修理申し込みをできる。,この場合、どこが悪いのかなどの連絡や修理代金の見積もりなどをメールでやり取りできる。
w201106-0002200175,その他根拠(順方向),ネットを使える人は、オンラインでも修理申し込みをできる。,人によってはこのほうがいいかも。
w201106-0002200175,その他根拠(順方向),この場合、どこが悪いのかなどの連絡や修理代金の見積もりなどをメールでやり取りできる。,人によってはこのほうがいいかも。
w201106-0000338131,逆接・譲歩(順方向)  原因・理由(順方向):少数意見,月の満ち欠けとともに営んでいた生活が改暦によって、太陽の巡りとともに生きていくこととなった。,しかし、人間側の勝手な改暦に反発し、
w201106-0000338131,談話関係なし  原因・理由(順方向):少数意見,月の満ち欠けとともに営んでいた生活が改暦によって、太陽の巡りとともに生きていくこととなった。,反対派の妖怪たちが様々な問題を起こすようになってしまう。
w201106-0000338131,原因・理由(順方向)  談話関係なし:少数意見,しかし、人間側の勝手な改暦に反発し、,反対派の妖怪たちが様々な問題を起こすようになってしまう。
w201106-0000338131,目的(順方向),陸軍と妖怪は、妖怪絡みの問題を解決するため,新組織『妖人省』を立ち上げた。
w201106-0001617144,談話関係なし  逆接・譲歩(順方向):少数意見,真一君と二人だけでいる時間は、どこかに喜びがあった。,喜びから来る緊張感のような物もあった。
w201106-0001617144,逆接・譲歩(順方向),真一君と二人だけでいる時間は、どこかに喜びがあった。,けれど、今の私にはそれがない。
w201106-0001617144,逆接・譲歩(順方向),喜びから来る緊張感のような物もあった。,けれど、今の私にはそれがない。
w201106-0002700234,談話関係なし  原因・理由(順方向):少数意見,この無駄の無さと、描き込みは、評価に値する部分ですよね。,すばらしい！！
w201106-0001463616,原因・理由(逆方向)  談話関係なし:少数意見,センター試験の対策は過去問研究につきる。,センター数学は、他の入試とはあらゆる面で異なる特殊な試験である。
w201106-0000545521,目的(順方向),雲南市民の足となって,走っているのが『雲南市民バス』です。
w201106-0000545521,談話関係なし  目的(順方向):少数意見,雲南市民の足となって,走っているのが広域路線バス、『吉田・大東線』です。
w201106-0000545521,談話関係なし  目的(順方向):少数意見,雲南市民の足となって,吉田町から大東町を年末年始の４日間を除いて毎日７往復の運行をしています。
w201106-0002000111,原因・理由(逆方向),スタイリングが苦手な方は是非来ていただきたいです。,毎日のスタイリングが簡単に出来る手助けをさせていただきます。
w201106-0000551446,原因・理由(順方向),さて、今回のデベロッパーキャンプでは、懇親会形式の番外セッションを企画しています。,ここでは、懇親会場へのアクセスをご案内したいと思います。
w201106-0000551446,逆接・譲歩(順方向)  談話関係なし:少数意見,さて、今回のデベロッパーキャンプでは、懇親会形式の番外セッションを企画しています。,懇親会場は、ここからちょっと離れています。
w201106-0000551446,原因・理由(逆方向),ここでは、懇親会場へのアクセスをご案内したいと思います。,懇親会場は、ここからちょっと離れています。
w201106-0000551446,逆接・譲歩(順方向),デベロッパーキャンプは、東京国際フォーラムで実施していますが、,懇親会場は、ここからちょっと離れています。
w201106-0000649818,逆接・譲歩(逆方向),青森県は“青い森”というように自然に恵まれています。,いわゆる高山はありませんが、
w201106-0000649818,逆接・譲歩(逆方向),森や山が多くあります。,いわゆる高山はありませんが、
w201106-0000649818,逆接・譲歩(順方向),いわゆる高山はありませんが、,高くないゆえに、その土地の人たちと密接にかかわってきました。
w201106-0000711471,目的(逆方向),人間は体内に食べ物を取り入れて,生きています。
w201106-0001368167,原因・理由(順方向),コンプライアンス最優先の中で、正しい排ガス分析は重要課題です。,排ガス分析計に関する技術者の育成は企業としての使命です。
w201106-0001368167,原因・理由(順方向),コンプライアンス最優先の中で、正しい排ガス分析は重要課題です。,・各種排ガス分析計の検出原理、構造について学習します。
w201106-0001368167,原因・理由(順方向),排ガス分析計に関する技術者の育成は企業としての使命です。,・各種排ガス分析計の検出原理、構造について学習します。
w201106-0000441347,原因・理由(順方向),ちょっとお気軽・お手軽ランチをご用意しました。,リーズナブルなお値段でゆっくりとお楽しみください。
w201106-0002700300,原因・理由(逆方向),今日は２時間遅刻をしてしまいました。,なんだか体が言う事を聞かないのです。
w201106-0002700300,原因・理由(逆方向),ゴールデンウィーク明けから、一週間に１回は遅刻しています。,なんだか体が言う事を聞かないのです。
w201106-0000098876,原因・理由(順方向),文学資料閲覧のための施設です。,貸出はできませんので
w201106-0000098876,逆接・譲歩(順方向),埼玉ゆかりの文学者の作品や文学関係の資料が閲覧できます。,貸出はできませんので
w201106-0000098876,逆接・譲歩(順方向),コピーサービスは１枚１０円で行っておりますが、,貸出はできませんので
w201106-0001150000,原因・理由(順方向),周辺を豊かな海に囲まれ、,優れた海の文化が花開きました。
w201106-0002900174,原因・理由(順方向)  談話関係なし:少数意見,銀座日航ホテルは、銀座の地にオープンして,銀座のランドマークとしてご愛顧いただいております。
w201106-0002900174,原因・理由(順方向)  談話関係なし:少数意見,銀座日航ホテルは、銀座の地にオープンして,抜群な立地は、ビジネスはもちろん観光の拠点としてもご好評いただいております。
w201106-0002900279,原因・理由(順方向),以前のカードにはない（ラメ）が表面にもはいってて,キラキラしてます！！
w201106-0000863841,原因・理由(順方向),全てのサービスを終了させて頂くこととなりました。,サービス終了後は全てのページを削除させていただきます。
w201106-0000863841,談話関係なし  原因・理由(順方向):少数意見,全てのサービスを終了させて頂くこととなりました。,あらかじめご了承いただきますようお願い申し上げます。
w201106-0001779511,原因・理由(順方向),というわけで最終回です。,色んな感情が湧いてきますが、
w201106-0001779511,目的(順方向),特典を求めて、,ゲーマーズととらのあなに買いに行く。
w201106-0001779511,逆接・譲歩(順方向),色んな感情が湧いてきますが、,けいおんの最終回らしい良い話だったと思います。
w201106-0000916707,条件(順方向),企業で、それなりに仕事をこなしていると、,報告書を書く必要が出てきます。
w201106-0000916707,対比(方向なし),海外にはそのノウハウを記した本は多いのですが、,国内では意外と少ないのが実情です。
w201106-0002900282,原因・理由(順方向),オーソドックスな片踏みロードペダル。,ドレスアップも楽しめる。
w201106-0002900282,条件(順方向),トークリップ＆ストラップを取付けると,さらにオールディー且つ新鮮で、
w201106-0002900282,条件(順方向)  談話関係なし:少数意見,トークリップ＆ストラップを取付けると,シールドベアリングによって快適なペダリングを得られる。
w201106-0002900285,原因・理由(順方向),ハンガーボルト部分、リンク機構とプーリーケージ結合部の２箇所が多少ぐらぐらするようです。,こりゃいずれ交換だな。
w201106-0002900285,原因・理由(順方向),ハンガーボルト部分、リンク機構とプーリーケージ結合部の２箇所が多少ぐらぐらするようです。,今回はとりあえず恐る恐るプーリーを外してみました。
w201106-0002900285,逆接・譲歩(順方向),こりゃいずれ交換だな。,今回はとりあえず恐る恐るプーリーを外してみました。
w201106-0000555237,談話関係なし  条件(順方向):少数意見,それを実践することです。,ダンサーは、自分次第で絶対になれます。
w201106-0001722632,原因・理由(順方向),ヤフオクでお買いものすることがあって、,それで、大体イーバンクかゆうちょ銀行でお支払いしてます。
w201106-0001722632,原因・理由(順方向),最近もいくつか落札してました。,それで、大体イーバンクかゆうちょ銀行でお支払いしてます。
w201106-0001722632,逆接・譲歩(順方向),イーバンクは今までイーバンク同士は振込手数料が無料だったのですが、,最近有料になってしまいました。
w201106-0001357286,条件(順方向),入会しない限り、,わからない。
w201106-0000553063,逆接・譲歩(順方向),露天風呂もあるが、,眺めは期待できない。
w201106-0000867872,原因・理由(順方向),充実の研修制度もありますので,しっかり勉強できます。
w201106-0000878110,談話関係なし  逆接・譲歩(順方向):少数意見,また、女性・男性問わず、,アンチエイジングの効能をうたった化粧品が人気です。
